{
  "artifacts": [],
  "binding": {
    "change_id": "m0-capability",
    "input_digest": "0000000000000000000000000000000000000000000000000000000000000000",
    "stage_visit": 1
  },
  "kind": "stage-ready",
  "proposal": null,
  "questions": [],
  "schema": "phixlin.execution-result.v1",
  "skill_invocations": [],
  "summary": "Structured output probe passed"
}
